{
  "$schema": "../../.modcreator/schema/mob.json",
  "kind": "mob",
  "id": "bluetusk",
  "name": "Bluetusk",
  "mob": {
    "model": "pig",
    "behavior": "neutral",
    "attackDamage": 4,
    "texture": "art/bluetusk.png",
    "babyTexture": "art/bluetusk_baby.png",
    "health": 12,
    "speed": 0.25,
    "width": 0.9,
    "height": 0.9,
    "food": "azure_plum",
    "drops": [{ "item": "minecraft:porkchop", "min": 1, "max": 3 }],
    "spawnEgg": "art/bluetusk_spawn_egg.png"
  }
}
